{
  "run_id": "run-1777879407",
  "user_instruction": "hello",
  "task_type": "knowledge_using",
  "source_scope": {
    "mode": "wiki_only",
    "allowed_sources": [
      "wiki/index.md",
      "wiki/log.md",
      "wiki/followups.md",
      "wiki/sources/",
      "wiki/topics/",
      "wiki/synthesis/",
      "wiki/outputs/"
    ],
    "disallowed_sources": [
      "web_search",
      "external_academic_search",
      "new_raw_source_ingest"
    ],
    "allowed_source_types": [
      "existing_wiki_state"
    ],
    "recency": "not specified",
    "expansion_policy": "ask_user_before_expanding"
  },
  "stages": [
    {
      "name": "discussion",
      "agent_skill": "research-os-discussion",
      "inputs": [
        "runs/run-1777879407/plan.json",
        "wiki/index.md"
      ],
      "outputs": [
        "runs/run-1777879407/final_answer.md"
      ],
      "may_mutate_wiki": false
    }
  ],
  "final_expected_artifact": "runs/run-1777879407/final_answer.md"
}
